[
  {
    "slug": "AIGuide",
    "title": "처음 시작하는 AI 활용법",
    "status": "published",
    "category": "AI 활용",
    "date": "2026-10-01",
    "description": "AI의 원리부터 최신 모델 비교와 앱 활용까지, GPT-6.1 Sol·Sonnet 5.5·Gemini 4 Argon 소식을 반영한 입문 안내",
    "meta": "2026년 10월 1일 기준 · 동적 슬라이드 29장"
  },
  {
    "slug": "CoopAICoordinator",
    "title": "협력 게임 AI 조정기 설계와 구현",
    "status": "published",
    "category": "캡스톤디자인",
    "date": "2026-10-02",
    "description": "대화 AI와 행동 AI 사이를 잇는 조정기의 설계, 이영호의 이번 주 구현과 10월 8일 통합 목표",
    "meta": "2026년 10월 2일 · 교수님 소개용 · 동적 슬라이드 8장"
  },
  {
    "slug": "CoopAIResearch",
    "title": "상황 변화 기반 재판단과 행동 AI 파인튜닝",
    "status": "published",
    "category": "캡스톤디자인",
    "date": "2026-10-02",
    "description": "DPT-Agent를 참고한 상황 기반 재판단과 행동 AI 파인튜닝: 자동 시연으로 이해하는 협동 문제·학습 사례·데이터 분리·네 조건 비교",
    "meta": "2026년 10월 2일 · 연구 방향 설명 · 자동재생 16장"
  },
  {
    "slug": "AIHitReaction",
    "title": "AI 기반 캐릭터 피격 반응",
    "status": "published",
    "category": "캡스톤 주제 검토",
    "date": "2026-10-02",
    "description": "물리 시뮬레이션의 반응을 학습한 자세 보정: 입력·데이터·MLP·엔진 연결·비교 실험을 자동 시연으로 설명",
    "meta": "2026년 10월 2일 · 독립 연구 후보 · 자동재생 16장",
    "pdf": false
  },
  {
    "slug": "CoopAINext",
    "title": "협동 게임 AI의 남은 반학기 연구와 응용",
    "status": "published",
    "category": "캡스톤디자인",
    "date": "2026-10-08",
    "description": "교수님 피드백과 11개 1차 출처를 바탕으로 제안하는 상황 기반 재판단·LoRA 비교, 평가 시나리오와 가상 작업 훈련 응용",
    "meta": "2026년 10월 8일 · 논문 그림 캡처 9개 · 연구·응용 계획 26장"
  },
  {
    "slug": "EntryHarnessScript",
    "title": "엔트리 하네스 발표 촬영 대본",
    "status": "published",
    "category": "촬영 대본",
    "date": "2026-10-19",
    "description": "엔트리 하네스 발표의 직접 촬영 구간만 모은 읽기용 대본. 도입·확장 방향·마무리를 한 문장씩 크게 표시합니다.",
    "meta": "2026년 10월 19일 · 카메라 촬영 3개 구간 · 13문장"
  }
]
